<?xml version="1.0" encoding="UTF-8"?>

<!ELEMENT Visitors (Visitor+)>

<!ELEMENT Visitor (Visitor.name, Visitor.email)>
<!ATTLIST Visitor
    id CDATA #REQUIRED
>

<!ELEMENT Visitor.name (#PCDATA)>
<!ELEMENT Visitor.email (#PCDATA)>
